{
    "taskid": "loans-join-bad",
    "pipelineids": ["pl2"],
    "type": "rs.pipeline.TaskJoin",
    "source": {
        "type": "internal",
        "tasks": ["loans-totalincome-bad","loanslookup-recipe"]
    },
    "compute": {
        "template": {
            "source": {
                "id": "loans-totalincome-bad",
                "joinfield": "credit_history",
                "copyfields": [
                    {
                        "name": "loan_ID"
                    },
                    {
                        "name": "totalincome"
                    },
                    {
                        "name": "gender"
                    },
                    {
                        "name": "married"
                    },
                    {
                        "name": "dependents"
                    },
                    {
                        "name": "credit_history"
                    }
                ]
            },
            "reference": {
                "id": "loanslookup-recipe",
                "joinfield": "cr_id",
                "copyfields": [ {"name": "label"} ]
            }
        }
    },
    "sink": {
        "type": "iris|table",
        "name": "PIPE.JOINEDINCOMEBAD",
        "namespace": "USER"
    },
    "metadata": {
        "creator": "rsingh"
    }
}