{
    "taskid": "tjoin",
    "pipelineids": ["p1"],
    "type": "rs.pipeline.TaskJoin",
    "source": {
        "type": "internal",
        "tasks": ["ttotinc", "tlookup"]
    },
    "compute": {
        "template": {
            "source": {
                "id": "ttotinc",
                "joinfield": "credit_history",
                "copyfields": [
                    {
                        "name": "loan_ID"
                    },
                    {
                        "name": "totalincome"
                    },
                    {
                        "name": "gender"
                    },
                    {
                        "name": "married"
                    },
                    {
                        "name": "dependents"
                    },
                    {
                        "name": "credit_history"
                    }
                ]
            },
            "reference": {
                "id": "tlookup",
                "joinfield": "cr_id",
                "copyfields": [ {"name": "label"} ]
            }
        }
    },
    "sink": {
        "type": "iris|table",
        "name": "RSPIPELINE.xyzjoined",
        "namespace": "USER"
    },
    "metadata": {
        "creator": "rsingh"
    }
}