{
    "taskid": "43443343443443",
    "pipelineids": ["p1","FECA6560-ED26-11EC-8DAF-F4D488652FDC"],
    "type": "rs.pipeline.TaskFieldCompute",
    "source": {
        "type": "internal",
        "tasks": ["85D0E4D0-ED27-11EC-8DAE-F4D488652FDC"]
    },
    "compute": {
        "template": { 
            "targetfield": "totalincome",
            "fields": ["applicantincome","coapplicantincome", "loan_ID", "gender", "married", "dependents", "credit_history"],
            "operation": "applicantincome + coapplicantincome"
        }
    },
    "sink": {
        "type": "iris|view",
        "name": "RSPIPELINE.xyztotinc",
        "namespace": "USER"
    },
    "metadata": {"created":"66202,14742.28642","modified":"66202,14742.28642","creator":"UnknownUser"}
}