{
    "taskid": "asdflj",
    "pipelineids": [],
    "source": {
        "type": "internal",
        "tasks": []
    },
    "type": "rs.pipeline.TaskSQLSelect",
    "compute": {
        "template": {
            "sql": "SELECT * FROM SAMPLETABLE WHERE a IS NOT NULL AND a > 0"
        }
    },
    "sink": {
        "type": "iris|view",
        "name": "RSPIPELINE.nonulla",
        "namespace": "USER"
    },
    "metadata": {}
}