{
    "taskid": "trecipe",
    "pipelineids": ["p1"],
    "type": "rs.pipeline.TaskRecipe",
    "source": {
        "type": "internal",
        "tasks": ["tloans","ttotinc"]
    },
    "sink": {
        "type": "task", 
        "name": "ttotinc"
    },
    "metadata": {"created":"66202,14742.28642","modified":"66202,14742.28642","creator":"UnknownUser"}
}