{
    "taskid": "85D0E4D0-ED27-11EC-8DAE-F4D488652FDC-AAAAB",
    "pipelineids": [
        "A1E30B30-EDA9-11EC-8EF4-F4D488652FDC"
    ],
    "source": {
        "type": "internal"
    },
    "type": "rs.pipeline.TaskPersistent",
    "compute": {},
    "sink": {
        "type": "iris|table",
        "name": "RSPIPELINE.XYZ",
        "namespace": "USER"
    },
    "metadata": {
        "creator": "rsingh",
        "publish": false,
        "modified": "66340,69185.808722",
        "name": "Unnamed task",
        "properties": [
            {
                "name": "Loan_ID",
                "type": "VARCHAR"
            },
            {
                "name": "Gender",
                "type": "VARCHAR"
            },
            {
                "name": "Married",
                "type": "VARCHAR"
            },
            {
                "name": "Dependents",
                "type": "INTEGER"
            },
            {
                "name": "Education",
                "type": "VARCHAR"
            },
            {
                "name": "Self_Employed",
                "type": "VARCHAR"
            },
            {
                "name": "ApplicantIncome",
                "type": "INTEGER"
            },
            {
                "name": "CoapplicantIncome",
                "type": "INTEGER"
            },
            {
                "name": "LoanAmount",
                "type": "INTEGER"
            },
            {
                "name": "Loan_Amount_Term",
                "type": "INTEGER"
            },
            {
                "name": "Credit_History",
                "type": "INTEGER"
            },
            {
                "name": "Property_Area",
                "type": "VARCHAR"
            },
            {
                "name": "Loan_Status",
                "type": "VARCHAR"
            }
        ],
        "rowcount": 1740
    }
}